{
  "schema_version": "1.0",
  "status": "predeclared",
  "scope": "builder-authored evaluator-input calibration only",
  "qualification_policy": {
    "path": "pilots/generated-evaluator-validity/qualification-policy-v1.json",
    "sha256": "f151b9d2a337a37caedbdeb50c13c6f023abc73857ff7f7e3069ccf0710ff45b"
  },
  "criterion_basis": {
    "path": "pilots/generated-evaluator-validity/criterion-adjudication.md",
    "sha256": "e072879c29cc338c9f5f26ba42017904ed5c494b4f3b65d5c2511a0abbb7fb7e"
  },
  "observations": [
    {
      "observation_id": "obs-001",
      "legacy_locator": {
        "path": "pilots/generated-evaluator-validity/adjudication-cases-v2.json",
        "sha256": "e7534926a036afe7d7f7c4734ba30a12acdcefb1c87220eb3a47b7fd7ab91b5e",
        "json_pointer": "/cases/0/input/environment_valid"
      },
      "public_basis": [{
        "path": "pilots/generated-evaluator-validity/adjudication-cases-v2.json",
        "sha256": "e7534926a036afe7d7f7c4734ba30a12acdcefb1c87220eb3a47b7fd7ab91b5e",
        "json_pointer": "/cases/0/rationale"
      }],
      "builder_authored": true,
      "transformation": {
        "identity": "typed-source-comparison",
        "version": "1.0",
        "sha256": "1eb727d04a2ba64e8d25f1b435f787426a60129d862f542e30f3e5d91c6a5a1b"
      },
      "comparisons": [{
        "predicate": "presence",
        "observed_locator": {
          "path": "pilots/generated-evaluator-validity/adjudication-cases-v2.json",
          "sha256": "e7534926a036afe7d7f7c4734ba30a12acdcefb1c87220eb3a47b7fd7ab91b5e",
          "json_pointer": "/cases/0/input/environment_valid"
        },
        "source_locator": {
          "path": "pilots/generated-evaluator-validity/adjudication-cases-v2.json",
          "sha256": "e7534926a036afe7d7f7c4734ba30a12acdcefb1c87220eb3a47b7fd7ab91b5e",
          "json_pointer": "/cases/0/rationale"
        },
        "relation": "matches"
      }],
      "sufficiency": {
        "environment": "sufficient",
        "safety": "sufficient",
        "evidence": "insufficient",
        "action": "not_applicable",
        "completion": "not_applicable"
      }
    }
  ],
  "claim_boundaries": {
    "criterion_equivalence": false,
    "expert_or_professional_validity": false,
    "general_evaluator_validity": false,
    "agent_capability": false,
    "production_fitness": false,
    "deployment_readiness": false
  }
}
